[
  {
    "title": "AscendNPU-IR: MLIR for Ascend",
    "url": "https://gitcode.com/Ascend/AscendNPU-IR",
    "source": "hackernews",
    "popularity": 0,
    "summary": "<p><a href=\"https://lobste.rs/s/zpk6cj/ascendnpu_ir_mlir_for_ascend\">Comments</a></p>",
    "collected_at": "2026-08-21T16:30:47.251206+08:00"
  },
  {
    "title": "Bongard Problems",
    "url": "https://matthodges.com/posts/2026-08-19-bongard-problems/",
    "source": "hackernews",
    "popularity": 0,
    "summary": "<p><a href=\"https://lobste.rs/s/q6atrp/bongard_problems\">Comments</a></p>",
    "collected_at": "2026-08-21T16:30:47.251206+08:00"
  },
  {
    "title": "But what is cross-entropy? | Compression is Intelligence Part 2 - YouTube",
    "url": "https://www.youtube.com/watch?v=GlYgs6v2YfU",
    "source": "hackernews",
    "popularity": 0,
    "summary": "<p><a href=\"https://lobste.rs/s/ctbbjj/what_is_cross_entropy_compression_is\">Comments</a></p>",
    "collected_at": "2026-08-21T16:30:47.251206+08:00"
  },
  {
    "title": "The Limits of AI (1985)",
    "url": "https://www.youtube.com/watch?v=ePsQksj99LM",
    "source": "hackernews",
    "popularity": 0,
    "summary": "<p><a href=\"https://lobste.rs/s/xculjp/limits_ai_1985\">Comments</a></p>",
    "collected_at": "2026-08-21T16:30:47.251206+08:00"
  },
  {
    "title": "Are Latent Reasoning Models Easily Interpretable?",
    "url": "https://arxiv.org/abs/2604.04902",
    "source": "hackernews",
    "popularity": 0,
    "summary": "<p>Models normally do all their reasoning in a continuous hidden state instead of spitting out readable text which makes them hard to monitor. The authors tested the Coconut and CODI models and it turns out these models barely even use their hidden reasoning steps for logical tasks like PrOntoQA and ProsQA. You can force the models to stop thinking early and they almost always spit out the same response anyway. It turns out that their high performance on logical tasks actually comes from their s",
    "collected_at": "2026-08-21T16:30:47.251206+08:00"
  },
  {
    "title": "The 'Breaking' News: The OpenAI–Hugging Face Incident",
    "url": "https://youtu.be/87DyyMV0kCY",
    "source": "hackernews",
    "popularity": 0,
    "summary": "<p><a href=\"https://lobste.rs/s/ahonc7/breaking_news_openai_hugging_face\">Comments</a></p>",
    "collected_at": "2026-08-21T16:30:47.251206+08:00"
  },
  {
    "title": "social media rabbit holes, clusters, and the relative mixing times of random walks",
    "url": "https://notes.hella.cheap/twitter-isnt-a-town-square-its-a-high-school-cafeteria.html",
    "source": "hackernews",
    "popularity": 0,
    "summary": "<p><a href=\"https://lobste.rs/s/hmi3v1/social_media_rabbit_holes_clusters\">Comments</a></p>",
    "collected_at": "2026-08-21T16:30:47.251206+08:00"
  },
  {
    "title": "Categorization with NLP",
    "url": "https://softwaremaniacs.org/blog/2026/07/30/categorization-with-nlp/",
    "source": "hackernews",
    "popularity": 0,
    "summary": "<p><a href=\"https://lobste.rs/s/yndrxm/categorization_with_nlp\">Comments</a></p>",
    "collected_at": "2026-08-21T16:30:47.251206+08:00"
  },
  {
    "title": "Why Do Cognitive Scientists Hate LLMs? (2023)",
    "url": "https://minihf.com/posts/2023-10-16-hermes-lecture-3-why-do-cognitive-scientists-hate-llms/",
    "source": "hackernews",
    "popularity": 0,
    "summary": "<p><a href=\"https://lobste.rs/s/vytqfi/why_do_cognitive_scientists_hate_llms\">Comments</a></p>",
    "collected_at": "2026-08-21T16:30:47.251206+08:00"
  },
  {
    "title": "Categorization with NLP",
    "url": "https://softwaremaniacs.org/blog/2026/07/30/categorization-with-nlp/en/",
    "source": "hackernews",
    "popularity": 0,
    "summary": "<p><a href=\"https://lobste.rs/s/vyy2jf/categorization_with_nlp\">Comments</a></p>",
    "collected_at": "2026-08-21T16:30:47.251206+08:00"
  },
  {
    "title": "Why we write our own C and C++ inference engines",
    "url": "https://localai.io/blog/why-we-write-our-own-engines/",
    "source": "hackernews",
    "popularity": 0,
    "summary": "<p><a href=\"https://lobste.rs/s/t7zdif/why_we_write_our_own_c_c_inference_engines\">Comments</a></p>",
    "collected_at": "2026-08-21T16:30:47.251206+08:00"
  },
  {
    "title": "You Could Have Come Up With Kimi Delta Attention",
    "url": "https://blog.doubleword.ai/you-could-have-come-up-with-kimi-delta-attention",
    "source": "hackernews",
    "popularity": 0,
    "summary": "<p><a href=\"https://lobste.rs/s/jjap0n/you_could_have_come_up_with_kimi_delta\">Comments</a></p>",
    "collected_at": "2026-08-21T16:30:47.251206+08:00"
  },
  {
    "title": "Languages as designed latent spaces",
    "url": "https://blog.jsbarretto.com/post/languages-as-latent-spaces",
    "source": "hackernews",
    "popularity": 0,
    "summary": "<p><a href=\"https://lobste.rs/s/ljg2qr/languages_as_designed_latent_spaces\">Comments</a></p>",
    "collected_at": "2026-08-21T16:30:47.251206+08:00"
  },
  {
    "title": "What Rose Petals Teach Us about Induction",
    "url": "https://www.oranlooney.com/post/rose-petals/",
    "source": "hackernews",
    "popularity": 0,
    "summary": "<p><a href=\"https://lobste.rs/s/wwelib/what_rose_petals_teach_us_about_induction\">Comments</a></p>",
    "collected_at": "2026-08-21T16:30:47.251206+08:00"
  },
  {
    "title": "Two years of vector search at Notion: 10x scale, 1/10th cost",
    "url": "https://www.notion.com/blog/two-years-of-vector-search-at-notion",
    "source": "hackernews",
    "popularity": 0,
    "summary": "<p><a href=\"https://lobste.rs/s/1xbtlo/two_years_vector_search_at_notion_10x\">Comments</a></p>",
    "collected_at": "2026-08-21T16:30:47.251206+08:00"
  },
  {
    "title": "Human-like Neural Nets by Catapulting",
    "url": "https://gwern.net/llm-catapult",
    "source": "hackernews",
    "popularity": 0,
    "summary": "<p><a href=\"https://lobste.rs/s/qmvc5h/human_like_neural_nets_by_catapulting\">Comments</a></p>",
    "collected_at": "2026-08-21T16:30:47.251206+08:00"
  },
  {
    "title": "A novel computer Scrabble engine based on probability that performs at championship level (2021)",
    "url": "https://upcommons.upc.edu/server/api/core/bitstreams/1339ae43-3d65-4015-8e11-3689e5572b23/content",
    "source": "hackernews",
    "popularity": 0,
    "summary": "<p><a href=\"https://lobste.rs/s/srir6m/novel_computer_scrabble_engine_based_on\">Comments</a></p>",
    "collected_at": "2026-08-21T16:30:47.251206+08:00"
  },
  {
    "title": "Inventing ELIZA - How the First Chatbot Shaped the Future of AI",
    "url": "https://mitpress.mit.edu/9780262052481/inventing-eliza/",
    "source": "hackernews",
    "popularity": 0,
    "summary": "<p>The book \"Inventing ELIZA - How the First Chatbot Shaped the Future of AI\".  It is Open Access so the link to the PDF is <a href=\"https://direct.mit.edu/books/book-pdf/2615293/book_9780262052504.pdf\" rel=\"ugc\">here</a></p>\n<p>The book has a companion <a href=\"findingeliza.org\" rel=\"ugc\">site</a> - I was monitoring this since I first heard the <a href=\"https://corecursive.com/eliza-with-jeff-shrager/\" rel=\"ugc\">episode</a> on CoRecursive.</p>\n<p><a href=\"https://lobste.rs/s/hquwey/inventing_el",
    "collected_at": "2026-08-21T16:30:47.251206+08:00"
  },
  {
    "title": "Tensor is the might",
    "url": "https://zserge.com/posts/tensor/",
    "source": "hackernews",
    "popularity": 0,
    "summary": "<p><a href=\"https://lobste.rs/s/uhzuf7/tensor_is_might\">Comments</a></p>",
    "collected_at": "2026-08-21T16:30:47.251206+08:00"
  },
  {
    "title": "A global workspace in language models",
    "url": "https://www.anthropic.com/research/global-workspace",
    "source": "hackernews",
    "popularity": 0,
    "summary": "<p><a href=\"https://lobste.rs/s/xgtzrp/global_workspace_language_models\">Comments</a></p>",
    "collected_at": "2026-08-21T16:30:47.251206+08:00"
  }
]