[
  {
    "title": "Why we write our own C and C++ inference engines",
    "url": "https://localai.io/blog/why-we-write-our-own-engines/",
    "source": "hackernews",
    "popularity": 0,
    "summary": "<p><a href=\"https://lobste.rs/s/t7zdif/why_we_write_our_own_c_c_inference_engines\">Comments</a></p>",
    "collected_at": "2026-08-03T19:15:22.302385+08:00"
  },
  {
    "title": "You Could Have Come Up With Kimi Delta Attention",
    "url": "https://blog.doubleword.ai/you-could-have-come-up-with-kimi-delta-attention",
    "source": "hackernews",
    "popularity": 0,
    "summary": "<p><a href=\"https://lobste.rs/s/jjap0n/you_could_have_come_up_with_kimi_delta\">Comments</a></p>",
    "collected_at": "2026-08-03T19:15:22.302385+08:00"
  },
  {
    "title": "Languages as designed latent spaces",
    "url": "https://blog.jsbarretto.com/post/languages-as-latent-spaces",
    "source": "hackernews",
    "popularity": 0,
    "summary": "<p><a href=\"https://lobste.rs/s/ljg2qr/languages_as_designed_latent_spaces\">Comments</a></p>",
    "collected_at": "2026-08-03T19:15:22.302385+08:00"
  },
  {
    "title": "What Rose Petals Teach Us about Induction",
    "url": "https://www.oranlooney.com/post/rose-petals/",
    "source": "hackernews",
    "popularity": 0,
    "summary": "<p><a href=\"https://lobste.rs/s/wwelib/what_rose_petals_teach_us_about_induction\">Comments</a></p>",
    "collected_at": "2026-08-03T19:15:22.302385+08:00"
  },
  {
    "title": "Two years of vector search at Notion: 10x scale, 1/10th cost",
    "url": "https://www.notion.com/blog/two-years-of-vector-search-at-notion",
    "source": "hackernews",
    "popularity": 0,
    "summary": "<p><a href=\"https://lobste.rs/s/1xbtlo/two_years_vector_search_at_notion_10x\">Comments</a></p>",
    "collected_at": "2026-08-03T19:15:22.302385+08:00"
  },
  {
    "title": "Human-like Neural Nets by Catapulting",
    "url": "https://gwern.net/llm-catapult",
    "source": "hackernews",
    "popularity": 0,
    "summary": "<p><a href=\"https://lobste.rs/s/qmvc5h/human_like_neural_nets_by_catapulting\">Comments</a></p>",
    "collected_at": "2026-08-03T19:15:22.302385+08:00"
  },
  {
    "title": "A novel computer Scrabble engine based on probability that performs at championship level (2021)",
    "url": "https://upcommons.upc.edu/server/api/core/bitstreams/1339ae43-3d65-4015-8e11-3689e5572b23/content",
    "source": "hackernews",
    "popularity": 0,
    "summary": "<p><a href=\"https://lobste.rs/s/srir6m/novel_computer_scrabble_engine_based_on\">Comments</a></p>",
    "collected_at": "2026-08-03T19:15:22.302385+08:00"
  },
  {
    "title": "Inventing ELIZA - How the First Chatbot Shaped the Future of AI",
    "url": "https://mitpress.mit.edu/9780262052481/inventing-eliza/",
    "source": "hackernews",
    "popularity": 0,
    "summary": "<p>The book \"Inventing ELIZA - How the First Chatbot Shaped the Future of AI\".  It is Open Access so the link to the PDF is <a href=\"https://direct.mit.edu/books/book-pdf/2615293/book_9780262052504.pdf\" rel=\"ugc\">here</a></p>\n<p>The book has a companion <a href=\"findingeliza.org\" rel=\"ugc\">site</a> - I was monitoring this since I first heard the <a href=\"https://corecursive.com/eliza-with-jeff-shrager/\" rel=\"ugc\">episode</a> on CoRecursive.</p>\n<p><a href=\"https://lobste.rs/s/hquwey/inventing_el",
    "collected_at": "2026-08-03T19:15:22.302385+08:00"
  },
  {
    "title": "Tensor is the might",
    "url": "https://zserge.com/posts/tensor/",
    "source": "hackernews",
    "popularity": 0,
    "summary": "<p><a href=\"https://lobste.rs/s/uhzuf7/tensor_is_might\">Comments</a></p>",
    "collected_at": "2026-08-03T19:15:22.302385+08:00"
  },
  {
    "title": "A global workspace in language models",
    "url": "https://www.anthropic.com/research/global-workspace",
    "source": "hackernews",
    "popularity": 0,
    "summary": "<p><a href=\"https://lobste.rs/s/xgtzrp/global_workspace_language_models\">Comments</a></p>",
    "collected_at": "2026-08-03T19:15:22.302385+08:00"
  },
  {
    "title": "Google’s exponential path to climate-wrecking digital bloat",
    "url": "https://ketanjoshi.co/2026/07/01/googles-exponential-path-to-climate-wrecking-digital-bloat/",
    "source": "hackernews",
    "popularity": 0,
    "summary": "<p><a href=\"https://lobste.rs/s/v8hk8q/google_s_exponential_path_climate\">Comments</a></p>",
    "collected_at": "2026-08-03T19:15:22.302385+08:00"
  },
  {
    "title": "Matrix Orthogonalization Improves Memory in Recurrent Models",
    "url": "https://ayushtambde.com/blog/matrix-orthogonalization-improves-memory-in-recurrent-models/",
    "source": "hackernews",
    "popularity": 0,
    "summary": "<p><a href=\"https://lobste.rs/s/k9qw5n/matrix_orthogonalization_improves\">Comments</a></p>",
    "collected_at": "2026-08-03T19:15:22.302385+08:00"
  },
  {
    "title": "Robust AI Security and Alignment: A Sisyphean Endeavor?",
    "url": "https://ieeexplore.ieee.org/document/11475847/",
    "source": "hackernews",
    "popularity": 0,
    "summary": "<p><a href=\"https://www.nist.gov/news-events/news/2026/06/nist-mathematical-proof-supports-transition-continuous-monitor-and-update\" rel=\"ugc\">NIST article</a> covers this paper well</p>\n<p><a href=\"https://lobste.rs/s/7exvix/robust_ai_security_alignment_sisyphean\">Comments</a></p>",
    "collected_at": "2026-08-03T19:15:22.302385+08:00"
  },
  {
    "title": "Convolutional Neural Networks in APL (2019)",
    "url": "https://dl.acm.org/doi/epdf/10.1145/3315454.3329960",
    "source": "hackernews",
    "popularity": 0,
    "summary": "<p><a href=\"https://lobste.rs/s/ibji5x/convolutional_neural_networks_apl_2019\">Comments</a></p>",
    "collected_at": "2026-08-03T19:15:22.302385+08:00"
  },
  {
    "title": "MAX models can now run on Apple silicon GPUs",
    "url": "https://forum.modular.com/t/max-models-can-now-run-on-apple-silicon-gpus/3283",
    "source": "hackernews",
    "popularity": 0,
    "summary": "<p><a href=\"https://lobste.rs/s/4srepl/max_models_can_now_run_on_apple_silicon\">Comments</a></p>",
    "collected_at": "2026-08-03T19:15:22.302385+08:00"
  },
  {
    "title": "AI Learns the \"Dark Art\" of RF Chip Design",
    "url": "https://spectrum.ieee.org/ai-radio-chip-design",
    "source": "hackernews",
    "popularity": 0,
    "summary": "<p><a href=\"https://lobste.rs/s/bxhmjt/ai_learns_dark_art_rf_chip_design\">Comments</a></p>",
    "collected_at": "2026-08-03T19:15:22.302385+08:00"
  },
  {
    "title": "Comparing Transformers and Hybrid Models at the Token Level",
    "url": "https://arxiv.org/pdf/2606.20936",
    "source": "hackernews",
    "popularity": 0,
    "summary": "<p><a href=\"https://lobste.rs/s/6c5c4j/comparing_transformers_hybrid_models_at\">Comments</a></p>",
    "collected_at": "2026-08-03T19:15:22.302385+08:00"
  },
  {
    "title": "GPT2-BASIC: Portable Machine Intelligence in BASIC",
    "url": "https://github.com/tsotchke/gpt2-basic",
    "source": "hackernews",
    "popularity": 0,
    "summary": "<p><a href=\"https://lobste.rs/s/mhjlia/gpt2_basic_portable_machine\">Comments</a></p>",
    "collected_at": "2026-08-03T19:15:22.302385+08:00"
  },
  {
    "title": "\"How to Think About AI\": Cory Doctorow on Big Tech, Understanding AI, Labor Automation &amp; More",
    "url": "https://www.youtube.com/watch?v=OBUzl_IaWIw",
    "source": "hackernews",
    "popularity": 0,
    "summary": "<p><a href=\"https://lobste.rs/s/n2r6r6/how_think_about_ai_cory_doctorow_on_big\">Comments</a></p>",
    "collected_at": "2026-08-03T19:15:22.302385+08:00"
  },
  {
    "title": "What does it mean to be a mathematician when AI does the math?",
    "url": "https://spectrum.ieee.org/ai-in-mathematics",
    "source": "hackernews",
    "popularity": 0,
    "summary": "<p><a href=\"https://lobste.rs/s/hvd5hk/what_does_it_mean_be_mathematician_when_ai\">Comments</a></p>",
    "collected_at": "2026-08-03T19:15:22.302385+08:00"
  }
]