[
  {
    "title": "OmniRoute",
    "url": "https://github.com/diegosouzapw/OmniRoute",
    "source": "github-trending",
    "popularity": 1929,
    "summary": "免费 MIT AI 网关：单端点接入 290+ 提供商、500+ 模型，支持 Claude/GPT/Gemini 等，配额感知自动切换",
    "collected_at": "2026-07-24T10:30:00+08:00"
  },
  {
    "title": "ai-engineering-from-scratch",
    "url": "https://github.com/rohitg00/ai-engineering-from-scratch",
    "source": "github-trending",
    "popularity": 802,
    "summary": "从零学习 AI 工程化：涵盖构建、部署与发布的完整实践教程",
    "collected_at": "2026-07-24T10:30:00+08:00"
  },
  {
    "title": "awesome-claude-skills",
    "url": "https://github.com/ComposioHQ/awesome-claude-skills",
    "source": "github-trending",
    "popularity": 636,
    "summary": "精选 Claude Skills 资源与工具合集，用于自定义 Claude AI 工作流",
    "collected_at": "2026-07-24T10:30:00+08:00"
  },
  {
    "title": "Kronos",
    "url": "https://github.com/shiyu-coder/Kronos",
    "source": "github-trending",
    "popularity": 401,
    "summary": "面向金融市场语言的基础模型（Foundation Model），用于金融领域的时序建模与预测",
    "collected_at": "2026-07-24T10:30:00+08:00"
  },
  {
    "title": "SkillOpt",
    "url": "https://github.com/microsoft/SkillOpt",
    "source": "github-trending",
    "popularity": 337,
    "summary": "微软推出的文本空间优化器，通过轨迹驱动编辑为冻结 LLM Agent 训练可复用的自然语言技能",
    "collected_at": "2026-07-24T10:30:00+08:00"
  },
  {
    "title": "pi-web",
    "url": "https://github.com/agegr/pi-web",
    "source": "github-trending",
    "popularity": 315,
    "summary": "pi 编码智能体的 Web UI 界面，提供可视化交互操作",
    "collected_at": "2026-07-24T10:30:00+08:00"
  },
  {
    "title": "ego-lite",
    "url": "https://github.com/citrolabs/ego-lite",
    "source": "github-trending",
    "popularity": 247,
    "summary": "面向人类与 AI Agent 并行工作的最佳浏览器，支持两者同时操作",
    "collected_at": "2026-07-24T10:30:00+08:00"
  },
  {
    "title": "text-to-cad",
    "url": "https://github.com/earthtojake/text-to-cad",
    "source": "github-trending",
    "popularity": 230,
    "summary": "面向 CAD、机器人与硬件设计的 Agent 技能集合",
    "collected_at": "2026-07-24T10:30:00+08:00"
  },
  {
    "title": "AstrBot",
    "url": "https://github.com/AstrBotDevs/AstrBot",
    "source": "github-trending",
    "popularity": 192,
    "summary": "AI Agent 助手与开发框架，集成多 IM 平台、多 LLM 和插件体系",
    "collected_at": "2026-07-24T10:30:00+08:00"
  },
  {
    "title": "open-code-review",
    "url": "https://github.com/alibaba/open-code-review",
    "source": "github-trending",
    "popularity": 180,
    "summary": "阿里巴巴开源的混合架构代码审查工具，结合确定性流水线与 LLM Agent，支持精确行级评论",
    "collected_at": "2026-07-24T10:30:00+08:00"
  },
  {
    "title": "serena",
    "url": "https://github.com/oraios/serena",
    "source": "github-trending",
    "popularity": 75,
    "summary": "强大的 MCP 编码工具包，提供语义检索与编辑能力，作为 Agent 的 IDE",
    "collected_at": "2026-07-24T10:30:00+08:00"
  },
  {
    "title": "awesome-ai-agents",
    "url": "https://github.com/slavakurilyak/awesome-ai-agents",
    "source": "github-trending",
    "popularity": 53,
    "summary": "收录 300+ Agentic AI 资源的精选列表",
    "collected_at": "2026-07-24T10:30:00+08:00"
  },
  {
    "title": "Rapid-MLX",
    "url": "https://github.com/raullenchai/Rapid-MLX",
    "source": "github-trending",
    "popularity": 18,
    "summary": "Apple Silicon 上最快的本地 AI 引擎，比 Ollama 快 4.2 倍，支持工具调用与 OpenAI 兼容接口",
    "collected_at": "2026-07-24T10:30:00+08:00"
  },
  {
    "title": "skypilot",
    "url": "https://github.com/skypilot-org/skypilot",
    "source": "github-trending",
    "popularity": 13,
    "summary": "面向前沿团队的 AI 计算平台，将碎片化 AI 算力统一为超级计算机",
    "collected_at": "2026-07-24T10:30:00+08:00"
  }
]
